"Application Reference","Application Type","Location Details","Proposal","Ward","Community","Decision","View"
"C21/1196/43/LL","Full Planning","Tŷ Rallt, Llithfaen, Pwllheli, Gwynedd, LL53 6PA","Gosod 2 res o baneli solar ffotofoltaidd ar gyfer defnydd domestigInstallation of 2 rows of photovoltaic solar panels for domestic use","Llanaelhaearn","Pistyll","","View","C21/1013/39/CC","Work on Protected Trees (TPO Consent)","Min Y Don Lôn Pont Morgan, Abersoch, Pwllheli, Gwynedd, LL53 7AG","Gwaith i goed sydd yn destun Gorchymyn Gwarchod Coed.Works to trees which are the subject of a Tree Preservation Order","Abersoch","Llanengan","","View","C21/1086/34/RC","Modification or Discharge of Planning Obligations","Y Nyth, Ynys Yr Arch, Bwlch Derwin, Garndolbenmaen, Gwynedd, LL51 9EQ","Diddymu cytundeb adran 106 sy'n rhwymo'r eiddo fel person lleol yn unig ar ganiatad rhif C05D/0144/34/LL/ Discharge section 106 agreement that ties the property as accomodation for local person only. on application ref C05D/0144/34/LL","Clynnog","Clynnog","","View","C21/1158/39/DT","Householder Planning","Swn Y Mor Hornblow Cottage, Llanengan, Pwllheli, LL53 7LG","Codi modurdy 3 drws ar wahân ynghyd a gwaith cysylltiol/ Proposed Detached 3 Door Garage including associated works","Llanengan","Llanengan","","View","C21/1150/26/LL","Full Planning","Treflan Uchaf, Waunfawr, Caernarfon, Gwynedd, LL55 4AX","Gosod gwaith trin carthion preifat/Installation of private sewerage treatement plant.","Waunfawr","Waunfawr","","View","C21/1147/11/DT","Householder Planning","Rhos Eithin Siliwen Road, Bangor, Gwynedd, LL57 2BS","Cais ar gyfer codi estyniad tŷ gwydr i flaen yr eiddo ynghyd a chodi modurdy / Application for a conservatory extension to front of dwelling and erection of garage","Garth (Bangor)","Bangor","","View","C21/1155/22/YA","Prior Approval (Agri/Forest)","Cae Ar Ddaliadaeth Fferm Taldrwst Sydd Yn Rhedeg Yn Gyfochrog A Lon Tyddyn Agnes, Caernarfon, LL54 6RR","Adeiladu trac amaethyddolConstruction of agricultural track.","Llanllyfni","Llanllyfni","","View","C21/1154/11/DT","Householder Planning","Ardwyn Siliwen Road, Bangor, Gwynedd, LL57 2BH","Cais ar gyfer codi estyniad tri llawr i gefn yr eiddo ynghyd a chodi balconi / Application to erect a three storey rear extension and creation of balcony","Menai (Bangor)","Bangor","","View","C21/1152/35/DT","Householder Planning","Neuadd Wen Morannedd, Criccieth, Gwynedd, LL52 0PP","Dymchwel modurdy cysylltiol a porth / lolfa wydr blaen, adeiladu estyniadau i'r ochr a'r cefn, ymestyn a codi teras blaen presennol fel rhan o welliannau hygyrcheddDemolition of attached garage and front porch/conservatory, erection of side and rear extensions, enlargement and raising of existing front terrace all as part of accessibility improvements","Criccieth","Criccieth","","View","C21/1144/39/LL","Full Planning","Goleufryn Lôn Pentre Bach, Abersoch, Pwllheli, Gwynedd, LL53 7ES","Codi estyniad ochr deulawr, estyniad unllawr yng nghefn yr estyniad ochr, estyniad cefn tri llawr gyda balconi ar y 3ydd llawr a balconi llawr cyntaf.Erection of a two storey side extension, single storey extension to the rear of the side extension, three storey rear extension with a balcony on the 3rd storey and first floor balcony.","Llanengan","Llanengan","","View","C21/1071/01/RA","Approval of Details Reserved by Condition","New Inn, Y Friog, Fairbourne, Gwynedd, LL38 2NX","Rhyddhau amod 4 (nodweddion nythu adar a manylion tirlunio a phlannu coed) ac amod 6 (defnyddiau) ar ganiatad cynllunio C17/0174/01/LLDischarge of condition 4 (bird nesting features and landscaping and tree planting details and condition 6  (materials) on planning permission C17/0174/01/LL","Llangelynnin","Arthog","","View","C21/1149/25/CR","Listed Building Consent","Bryn Tirion, Y Felinheli, LL56 4JX","Addasiadau mewnol ac allanol i'r adeilad / Internal and external alterations to building","Pentir","Pentir","","View","C21/1142/34/DT","Householder Planning","Tan Y Fron, Aberdesach, Caernarfon, Gwynedd, LL54 5BP","NEWIDIADAU AC ESTYNIADAU I DO'R TY.ALTERATIONS AND ROOF EXTENSIONS TO THE DWELLING","Clynnog","Clynnog","","View","C21/1139/39/RA","Approval of Details Reserved by Condition","Carmel Chapel Lôn Coed Y Fron, Mynytho, Pwllheli, Gwynedd, LL53 7SF","Cais i ryddhau Amod 3 (Cofnod Ffotograffig) o ganiatâd cynllunio C21/0715/39/DT ar gyfer ymgorffori adeilad capel segur yn rhan o'r  tŷ cyswllt.Application to discharge Condition 3 (Photographic Record) of planning permission C21/0715/39/DT for the incorporation of redundant chapel building as part of adjoining house.","Llanengan","Llanengan","Approved (Without Conditions)","View","C21/1123/17/LL","Full Planning","Glynllifon Park, Llandwrog, Caernarfon, Gwynedd, LL54 5DY","Uwchraddio maes parcio presennol yn cynnwys creu lôn fynediad newydd un ffordd o gwmpas yr ardal maes parcio presennol ynghyd â chreu llwybr newydd i bedestriad/Upgrade to current car park facility to include a new one way access road around the perimeter of the car park along with a new footpath for pedestrians.","Groeslon","Llandwrog","","View","C21/1119/14/DT","Householder Planning","Dashenka, 11 Pengelli Wyn, Caernarfon, Gwynedd, LL55 1EA","Cais i drosi atig a chreu estyniad i dormer at gefn yr eiddo er mwy creu dau ystafell wely ac ystafell ymolchi/Attic conversion & dormer extension to rear of dwelling to provide 2 bedrooms and a bathroom.","Cadnant (Caernarfon)","Caernarfon","","View","C21/1040/23/AC","Removal/Variation of Condition(s)","48 Nant Y Glyn, Llanrug, Caernarfon, Gwynedd, LL55 4AH","Cais i ddiwygio amod 3 ar gais C21/0356/23/DT sy'n ymwneud a newid dyluniad sydd at flaen y ty o estyniad deulawr i estyniad unllawr/ Application to vary condition 3 on application C21/0356/23/DT relating to altering from a two storey front extension to a single storey front extension.","Llanrug","Llanrug","","View","C21/1136/35/LL","Full Planning","Land Adjacent To North Terrace, Criccieth, LL52 0BA","Adeiladu 23 annedd, creu mynedfa newydd o Ffordd Caernarfon, ffordd ystad mewnol, pwll gwanhad dwr wyneb a gwaith cysylltiolErection of 23 dwellings, creation of a new access from Caernarfon Road, an internal estate road, surface water attenuation pond and associated works","Criccieth","Criccieth","","View","C21/1132/23/DT","Householder Planning","Pen Y Graig Lôn Ceunant, Ceunant, Caernarfon, Gwynedd, LL55 4SA","Estyniad deulawr.Two storey extension.","Cwm y Glo","Llanrug","","View","C21/1129/23/DT","Householder Planning","Rhyd Y Delyn Ffordd Glan Moelyn, Llanrug, Caernarfon, Gwynedd, LL55 4PH","Estyniad unllawr cefnSingle storey rear extension","Llanrug","Llanrug","","View","C21/1118/24/DT","Householder Planning","Tŷ Gwyn, Rhosgadfan, Caernarfon, Gwynedd, LL54 7LD","Estyniad ochr a cefn i dy annedd/Side and rear extension,","Llanwnda","Llanwnda","","View","C21/1117/41/LL","Full Planning","Cefn Coed, Chwilog, Pwllheli, Gwynedd, LL53 6NX","Mynedfa amaethyddol newyddNew agricultural access","Llanystumdwy","Llanystumdwy","","View","C21/1116/19/DT","Householder Planning","Tegfan, Bontnewydd, Caernarfon, Gwynedd, LL54 7UN","Codi uchder to ac adeiladu ffenestr gromen newydd i ddrychiad blaen a cefnRaising roof and construction of  new dormer window to the front and rear elevation.","Bontnewydd","Bontnewydd","","View","C21/0959/11/LL","Full Planning","290 - 294 High Street, Bangor, Gwynedd, LL57 1UL","Codi adeilad newydd ar gyfer 6 uned breswyl, newid defnydd y llawr gwaelod i wagle hyblyg Defnydd Dosbarth A1, A2, A3 a/neu B1 ynghyd ac addasu'r lloriau uwchben i 18 uned breswyl gyda newidiadau ac estyniadau cysylltiedig. Erection of new building to accommodate 6 residential apartments,  change of use of building to flexible commercial space on ground floor Use Class A1, A2, A3 and/or B1 and conversion of above floors to 18 residential units with associated extensions and alterations.","Deiniol (Bangor)","Bangor","","View","C21/1146/39/DT","Householder Planning","Bungalow, Sorton Villa, Bwlchtocyn, Pwllheli, Gwynedd, LL53 7BN","Addasiad ac estyniad arfaethedig ynghyd ag addasu'r anecs / storfa bresennol yn llety ychwanegolProposed alteration and extension together with adaptation of existing annex/store to additional accommodation","Llanengan","Llanengan","","View","C21/1133/42/CC","Work on Protected Trees (TPO Consent)","Rhos Bridin Lôn Pen Rhos, Morfa Nefyn, Pwllheli, Gwynedd, LL53 6BL","Tocio at uchder bob-docio un onnen aeddfed sydd â salwch gwywo ynn ac sy'n destun Gorchymyn Gwarchod CoedThe topping to pollard of one mature ash tree infected by ash dieback disease which is subject to a Tree Preservation Order.","Morfa Nefyn","Nefyn","","View","C21/1128/42/LL","Full Planning","Goleufryn Lôn Uchaf, Morfa Nefyn, Pwllheli, Gwynedd, LL53 6AL","Rhannol ddymchwel estyniadau cefn presennol a chodi estyniad unllawr newydd/Part demolition of existing rear extensions and construction of new single storey extension.","Morfa Nefyn","Nefyn","","View","C21/1113/41/DT","Householder Planning","Tyddyn Ychain, Chwilog, LL53 6PP","Estyniad deulawr ochrTwo storey side extension","Llanystumdwy","Llanystumdwy","","View","C21/1102/01/LL","Full Planning","Swn Y Mor Holiday Park, Penrhyn Road South , Fairbourne, LL38 2DZ","Newid defnydd cae  er mwyn ymestyn y safle carafanau a cynnyddu'r nifer o unedau o 6 i 8Change of use of field to extend the caravan site and to increase the number of units from 6 to 8","Llangelynnin","Arthog","","View","C19/1136/42/CR","Listed Building Consent","Whitehall, Porth Dinllaen, Gwynedd, LL53 6DB","Gosod bracedi ar gefn yr adeilad a shutters er gosod bordiau llifogydd / Install brackets and shutters to the rear of the building to site flood boards","Morfa Nefyn","Nefyn","","View","C21/1104/08/DT","Householder Planning","Werddon, Penrhyndeudraeth, Gwynedd, LL48 6RA","Dymchwel adeilad allanol a modurdy presennol a chodi estyniad deulawr i'r tŷ gydag adain unllawr cysylltiedig i'r blaen yn cynnwys gweithdy a modurdy dwbl   Demolition of existing outbuilding and garage and constructi a two storey extension to the dwelling with attached single storey wing to include workshop and double garage","Penrhyndeudraeth","Penrhyndeudraeth","","View","C21/1096/35/LL","Full Planning","1 Castle Street, Criccieth, LL52 0DP","Gosod llwyfan bren yng nghefn yr adeilad er mwyn creu  man eistedd allanol i'r caffi   Install decking at the rear of the building to create an external seating area for the cafe","Criccieth","Criccieth","","View","C21/1137/16/CT","Tree Felling in Conservation Area","Y Wern, 2 Llandygai Village, Llandygai, Bangor, Gwynedd, LL57 4HU","Cais ar gyfer gwneud gwaith i goeden oddi fewn i Ardal Gadwraeth / Application for works to trees within Conservation Area","Arllechwedd","Llandygai","","View","C21/1131/18/DT","Householder Planning","Glanrafon Isaf, Penisarwaun, Caernarfon, Gwynedd, LL55 3DB","Estyniad un llawr to gwastad yn y cefn/Single storey flat roofed extension at the rear.","Penisarwaun","Llanddeiniolen","","View","C21/1089/08/LL","Full Planning","3, Pant Yr Ynn Pool Street, Penrhyndeudraeth, Gwynedd, LL48 6NG","Tŷ newydd  / New dwelling","Penrhyndeudraeth","Penrhyndeudraeth","","View","C21/1081/40/DT","Householder Planning","Ceod Y Garth Lôn Caernarfon, Llwyndyrys, Pwllheli, Gwynedd, LL53 6RN","Estyniad deulawr at gefn ty annedd/Two storey rear extension. Estyniad deulawr at gefn ty annedd.","Abererch","Llannor","","View","C21/0957/41/LL","Full Planning","Bron Eifion Hotel, Llanystumdwy, Criccieth, Gwynedd, LL52 0SA","Lleoli 3 pod gwyliau hunan gynhaliol, gosod system drin preifat  a gwaith cysylltiedigSiting of 3 self contained holiday pods, private treatement plant and associated works","Llanystumdwy","Llanystumdwy","","View","C21/1130/03/RA","Approval of Details Reserved by Condition","Meirion House, Tanygrisiau, Blaenau Ffestiniog, Gwynedd, LL41 3SU","Rhyddhau amod 3 (gorffeniad allanol y modurdy) ar ganiatad cynllunio C21/0596/03/LLDischarge condition 3 (external appearance of garage) on planning permission C21/0596/03/LL","Bowydd & Rhiw","Ffestiniog","","View","C21/1126/39/CC","Work on Protected Trees (TPO Consent)","Abersoch Moorings, Min Y Don, Abersoch, Pwllheli, LL53 7AG","Cais i dorri dwy goeden (Cupressus Macrocarpa) sy'n destun Gorchymyn Gwarchod Coed.Application to fell two trees (Cupressus Macrocarpa)  that are subject to a Tree Preservation Order.","Abersoch","Llanengan","","View","C21/1122/43/DT","Householder Planning","Tabor Chapel, Llithfaen, Pwllheli, Gwynedd, LL53 6NL","Gosod balconiErection of a balcony","Llanaelhaearn","Pistyll","","View","C21/1115/44/RA","Approval of Details Reserved by Condition","Ty Moelwyn, Porthmadog, LL49 9AB","Rhyddhau amod 13 (Cynllun Argyfwng Llifogydd) ac amod 18 (manylion ffens) ar ganiatad cynllunio C18/0520/44/LLDischarge condition 13 (Emergency Flood Plan) and condition 18 (fencing details) on planning approval C18/0520/44/LL","Porthmadog (West)","Porthmadog","","View","C21/1098/46/LL","Full Planning","Gwyndy, Tudweiliog, Pwllheli, Gwynedd, LL53 8NH","CODI TO NEWYDD DROS IARD WARTHEG BRESENNOLERECTION OF NEW ROOF OVER  EXISTING CATTLE YARD","Tudweiliog","Tudweiliog","","View","C21/1084/39/MG","Approval of Reserved Matters","Plot Ger / Plot By Arwelfa, Lon Traeth, Abersoch, Pwllheli, LL53 7BA","Cais i gytuno
materion a gadwyd yn ôl yn ymwneud â Gosodiad, Graddfa ac Edrychiad mewn
perthynas a chaniatâd cynllunio C18/1079/39/AM ar gyfer codi tŷ a chreu mynedfa
