"Application Reference","Application Type","Location Details","Proposal","Ward","Community","Decision","View"
Proposed porch to front and proposed dormer window to the rear.","Llanaelhaearn","Pistyll","Refused","View","C21/0929/38/DT","Householder Planning","Cadwgan Glynyweddw Estate, Llanbedrog, Pwllheli, Gwynedd, LL53 7TT","Estyniad unllawr i'r prif edrychiad.Single storey extension to the principle elevation.","Llanbedrog","Llanbedrog","Approved with Conditions","View","C21/0909/38/DT","Householder Planning","Y Llusern, 11 Glyn Y Môr, Llanbedrog, Pwllheli, Gwynedd, LL53 7NW","Cynyddu llethr y to i greu ystafelloedd gwely ar y llawr cyntaf ac ymestyn y teras cefn.Increase the roof pitch to create first floor bedrooms and extend the rear terrace.","Llanbedrog","Llanbedrog","","View","C21/0839/44/RA","Approval of Details Reserved by Condition","Tesco High Street, Porthmadog, Gwynedd, LL49 9NU","Rhyddhau amod 1 (Cynllun Rheolaeth Sŵn Cyflenwi) o ganiatâd cynllunio C20/1052/44/AC i ddiwygio amseroedd derbyn nwyddau.Discharge of Condition 1 (Delivery Noise Management Plan)  of planning permission C20/1052/44/AC to amend the delivery hours.","Porthmadog (West)","Porthmadog","Condition(s) Fully Discharged","View","C21/0925/11/HY","Advertisement Consent (HY)","Currys  Mena Retail Park Caernarfon Road, Bangor, LL57 4SJ","Cais ar gyfer gosod 2 arwydd ffasgia heb eu goleuo, 1 arwydd ffasgia wedi ei oleuo, 6 arwydd heb eu oleuo ynghyd a 9 arwydd finyl sy'n cynnwys cyfarwyddiadau ac hyrwyddant / Application to install 2 non-illuminated fascia signs, 1 internally illuminated fascia sign, 6 non-illuminated signs and 9 vinyl signs which contain directional instructions and promotions","Dewi (Bangor)","Bangor","","View","C21/0891/44/AC","Removal/Variation of Condition(s)","10, Cae Ffynnon Chalet Park Beach Road, Morfa Bychan, Porthmadog, Gwynedd, LL49 9YQ","Diwygio amod 2 ar ganiatad cynllunio 33/65/139H er mwyn diwygio cyfnod meddiannu'r siale i rhwng 1 Mawrth i 31 Rhagfyr mewn unrhyw flwyddynVary condition 2 on planning permission 33/65/139H to amend the occupancy period for the chalet to between 1 March and 31 December in any year","Porthmadog (West)","Porthmadog","Approved with Conditions","View","C21/0773/23/LL","Full Planning","Plas Tirion, Llanrug, Caernarfon, Gwynedd, LL55 4PY","Codi adeilad amaethyddol i'w ddefnyddio ar gyfer cadw tail a phob gwaith cysylltiol.Erection of an agricultural building to be used as a manure store and all associated works","Cwm y Glo","Llanrug","","View","C21/0918/18/TC","Lawful Development Certificate Existing/Proposed","Carafan, Carreg Y Garth Isaf Allt Rhiwlas, Rhiwlas, Bangor, Gwynedd, LL57 4GA","Defnydd o siale fel uned anheddol (Dosbarth Defnydd C3) / Use of chalet as residential unit (C3 Use Class).","Penisarwaun","Llanddeiniolen","","View","C21/0916/20/AC","Removal/Variation of Condition(s)","Greenwood Centre, Y Felinheli, Gwynedd, LL56 4QN","Cais ar gyfer diwygio amod 2 ac 8 o ganiatâd cynllunio cyfeirnod C20/1019/20/LL ar gyfer gosod 8 'tipi' a bloc toiledau a chawodydd ar gyfer defnydd gwyliau er mwyn newid dyluniad y bloc toiledau a chawodydd ynghyd ac ei gadw ar y safle yn barhaol / Application to amend condition 2 and 8 of planning permission reference C20/1019/20/LL for the siting of 8 tipis and toilet & shower block for holiday accomodation so as to amend the design of the toilet and shower block and retain it on site permanently","Bethel","Llanddeiniolen","Approved with Conditions","View","C21/0912/09/LL","Full Planning","Merton Villa High Street, Tywyn, Gwynedd, LL36 9AD","Cais ôl-weithredol i gadw caban o fewn cwrtil ty annedd /  Retrospective application for retention of cabin within curtilage of dwelling house.","Tywyn","Tywyn","","View","C21/0908/35/DT","Householder Planning","Tregennis Lower Morannedd, Criccieth, Gwynedd, LL52 0LA","Estyniad deulawr ochr,  addasu atig yn ystafell wely gyda ffenestri to a theras i'r blaen a ffenestr gromen cefn, ymestyn cwrtil a chodi ystafell ardd. Two storey side extension, bedroom loft conversion with roof windows and terrace to front and dormer window to rear, extend curtilage and erect garden room.","Criccieth","Criccieth","","View","C21/0907/45/CC","Work on Protected Trees (TPO Consent)","Talcymerau Mawr Ffordd Talcymerau, Pwllheli, Gwynedd, LL53 5PW","Torri dwy goeden ac ymgymryd â gwaith tocio a chynnal ar goed sy'n destun Gorchymyn Gwarchod CoedFell two trees and undertake pruning and maintanance works to trees subject to Tree Preservation Order","Pwllheli (South)","Pwllheli","","View","C21/0905/08/DT","Householder Planning","Craig Yr Awel, Penrhyndeudraeth, Gwynedd, LL48 6DW","Addasu modurdy/storfa integredig ar yr islawr yn anecsConversion of lower ground integral garage/ store into annexe","Penrhyndeudraeth","Penrhyndeudraeth","Approved with Conditions","View","C21/0896/35/DT","Householder Planning","Cartrefle Llwyn Brith, Criccieth, Gwynedd, LL52 0TA","Codi porth newydd i flaen yr eiddo, ymestyn storfa unllawr ochr ac addasiadau allanolErect new porch to front of property, extend single storey side store and external alterations","Criccieth","Criccieth","Approved with Conditions","View","C21/0888/14/DA","Non-Material Amendment","Tir Rhwng / Land Between Tan Y Garth A Cefn Gwyndre, Lôn Ddewi, Caernarfon, LL55 1BH","Cais am ddiwygiad ansylweddol i ganiatad rhif C21/0327/14/LL i ddiwygio defnyddiau a ganiatawyd ar flaen y ty, cynnyddu maint ffenestr a newid lliwiau bwriededig y fasia, peipiau dwr a drws blaen.Application for non material amendment to planning consent number C21/0327/14/LL to amend the approved materials on the front of the dwelling, enlarge window opening and change the proposed colours to fascias, downpipes and front door.","Menai (Caernarfon)","Caernarfon","","View","C21/0879/18/DT","Householder Planning","16 Bro Rhiwen, Rhiwlas, Bangor, Gwynedd, LL57 4EL","Dymchwel yr adeiladau allanol a chodi estyniadau yn eu lle/Demolish existing outbuildings and erect extensions in their place.","Penisarwaun","Llanddeiniolen","Approved with Conditions","View","C21/0873/14/LL","Full Planning","Byw'n Iach Arfon, Ffordd Bethel, Caernarfon, LL55 1DU","Gosod 6 ffenestr ar gyfer golau naturiol.Installation of 6 windows for natural light.","Menai (Caernarfon)","Caernarfon","","View","C21/0914/39/DT","Householder Planning","Fferm Sarn Lôn Sarn Bach, Sarn Bach, Pwllheli, Gwynedd, LL53 7BG","Cais i ail wampio bwthyn presennol, dymchwel adeiladau allanol a chodi estyniad newydd i'r ochr/Refurbishment of existing cottage, demolish existing outbuildings and erection of new exension to side elevation","Llanengan","Llanengan","Refused","View","C21/0903/11/LL","Full Planning","Oriental Grocery Food,  25-27 Holyhead Road, , Bangor, LL57 2EU","Newid defnydd  o storfa siop i fwyty ar y llawr cyntaf ynghyd a gosod ffliw echdynnu yn y cefn.Change of use of shop store on the first floor into a restaurant together with siting of an extraction flue at the rear.","Menai (Bangor)","Bangor","Approved with Conditions","View","C21/0898/22/AC","Approval of Details Reserved by Condition","Land To The Rear Of Cochrwd House, Baptist Street, Penygroes, LL54 6NU","Erection of a building to accommoddate plant and Machinery for the applicants own personal use together with creating a new driveway and hard standing","Penygroes","Llanllyfni","","View","C21/0893/20/DT","Householder Planning","Llifon Bryn Ffynnon, Y Felinheli, Gwynedd, LL56 4SQ","Dymchwel y modurdy presennol, codi estyniad deulawr, codi balconi ar y llawr cyntaf a lledu'r fynedfa bresennol. Demolishing existing garage, construction of two story extension, construction of balcony on the first floor and widening of existing access.","Y Felinheli","","Approved with Conditions","View","C21/0892/20/DT","Householder Planning","Rallt Bryn Y Waen, Y Felinheli, Gwynedd, LL56 4QJ","Cais ar gyfer codi estyniad un llawr to un-codiad i flaen a chefn yr eiddo / Application to erect a single story lean-to extension to front and rear of dwelling","Y Felinheli","","Approved with Conditions","View","C21/0865/33/LL","Full Planning","Gors Yr Hafod, Rhydyclafdy, Pwllheli, Gwynedd, LL53 8PL","Dymchwel yr annedd presennol ac adeiladu ty newydd yn ei le/Demolish existing dwelling and construction of a new replacement dwelling","Efailnewydd / Buan","Buan","Approved with Conditions","View","C21/0811/17/LL","Full Planning","Uwchlaw'r Rhos, Penygroes, Caernarfon, Gwynedd, LL54 7UE","Gwaith peirianyddol ar gyfer adeiladu dau adeilad amaethyddol gyda morlyn slyri ar lawr un adeilad/ Engineering works to create two agricultural buildings with one building to include underfloor slurry storage.","Talysarn","Llandwrog","","View","C21/0913/11/AC","Removal/Variation of Condition(s)","372 High Street, Bangor, Gwynedd, LL57 1YE","Cais ar gyfer diwygio amod 1 o ganiatâd cynllunio cyfeirnod C16/1617/11/LL ar gyfer trosi uned fasnachol yn fflat ddeulofft er mwyn ymestyn cyfnod dechreuad y datblygiad  o 5 mlynedd ychwanegol / Amend condition 1 of planning permission reference C16/1617/11/LL for the conversion of commercial unit to two-bedroomed flat so as to extend the development commencement period for an additional 5 years.","Deiniol (Bangor)","Bangor","","View","C21/0902/17/DT","Householder Planning","Beach Cottage, Dinas Dinlle, Caernarfon, Gwynedd, LL54 5TW","Estyniad i modurdy ac ailadeiladu / ymestyn ystafell haul bresennolGarage extension and rebuilding/extension of existing sun room/wc","Groeslon","Llandwrog","","View","C21/0884/35/DT","Householder Planning","Haul A Gwynt Morannedd, Criccieth, Gwynedd, LL52 0PP","Estyniadau deulawr bwriadedig i'r talcen dwyreiniol a gorllewinol yn dilyn dymchwel y modurdy to fflat presennol, ychwanegu porth wedi ei glymu o amgylch a gwaith allanol i greu patio a 'decking' wedi ei derasuProposed two storey extensions to east and west gables after demolition of the existing flat roofed garage, addition of wrap round porch and external works to create terraced patio and deck","Criccieth","Criccieth","","View","C21/0906/01/DT","Householder Planning","72 Glan Y Môr, Fairbourne, Gwynedd, LL38 2LQ","Estyniadau unllawr i anneddSingle storey extensions to dwelling","Llangelynnin","Arthog","Approved with Conditions","View","C21/0904/09/AC","Removal/Variation of Condition(s)","15 Morfa Crescent, Tywyn, Gwynedd, LL36 9AU","Cais i ddiwygio amod 2 ar ganiatad cynllunio C21/0492/09/DT er mwyn lleihau graddfa'r estyniad ochrApplication to vary condition 2 on planning permission C21/0492/09/DT in order to reduce the scale of the side extension","Tywyn","Tywyn","Approved with Conditions","View","C21/0895/46/DT","Householder Planning","Tan Y Ffordd, Garn Fadryn, Pwllheli, Gwynedd, LL53 8TG","Codi adeilad ar wahân i'w ddefnyddio fel anecs, codi modurdy ddwbl ar wahân, dymchwel adeilad allanol, creu mynedfa gerbydol newydd a chau mynedfa bresennol ynghyd ag ymestyn cwrtil, creu rhodfa gerbydol a llecyn parcio a throi/Construction of a detached annexe building, construction of a detached double garage, demolish existing outbuilding, creation of a new vehicular access and closure of existing access, extend curtilage, create vehicular track, parking and turning space.","Tudweiliog","Tudweiliog","Approved with Conditions","View","C21/0890/39/RA","Approval of Details Reserved by Condition","Ynys Fôr Bach Lôn Sarn Bach, Abersoch, Pwllheli, Gwynedd, LL53 7EL","Cais i ryddhau amodau cynllunio 3 (llechi to) a 4 (deunyddiau allanol) o ganiatâd cynllunio cyf. C17/0628/39/LLApplication to dishcarge conditions 3 (roofing slates) and 4 (external materials) of planning permission C17/0628/39/LL","Abersoch","Llanengan","Approved (Without Conditions)","View","C21/0734/46/LL","Full Planning","Tyddyn Isaf, Tudweiliog, Pwllheli, Gwynedd, LL53 8PB","Cais llawn i newid defnydd tir amaethyddol er mwyn creu safle carafanau ar gyfer 32 llain, codi adeilad newydd i gynnwys cawodydd/toiledau, holl lleiniau caled cysylltiedig, ail wynebu a mynediad/A full planning application for change of use of agricultural land to form a caravan site for 32 pitches, construction of a new amenity building and all associated hardstanding, re-surfacing and access'","Tudweiliog","Tudweiliog","","View","C21/0587/14/AC","Removal/Variation of Condition(s)","Gwynedd Skip Hire, Gwynedd Skip Hire Cibyn Industrial Estate, Caernarfon, Gwynedd, LL55 2BD","Cais o dan Adran 73 o’r Ddeddf
Cynllunio Gwlad a Thref 1990 i amrywio Amod 8 ar ganiatâd cynllunio
C08A/0209/14/LL (Estyniad i’r safle ailgylchu presennol, codi adeilad
trosglwyddo gwastraff newydd, cyfleusterau parcio a chodi sgrin perimedr 5 metr
o uchder) i gynyddu’r uchafswm trwygyrch flynyddol o wastraff i 125,000 tunnell
ar gyfradd uchaf o 1,200 tunnell y dydd a dim mwy na 2,800 tunnell yr wythnos /
Application under Section 73 of the Town and Country Planning Act 1990 to vary
Condition 8 on planning permission C08A/0209/14/LL (Extension of existing
recycling site with erection of new waste transfer building, parking facilities
and erection of 5 metre-high perimeter screen) to increase the maximum annual
throughput of waste to 125,000 tonnes at a maximum rate of 1,200 tonnes per day
